{
  "$schema": "https://json-schema.org/draft/2020-12/schema",
  "$id": "docs/specs/role-spec-template.schema.json",
  "title": "role-spec-template",
  "description": "Shape every roles/specs/<name>.spec.json must match (issue #515 realization template, realized batch-1 by issue #521). Hand-checked by gates/role_spec_shape.py — this file documents the shape; it is not itself fed to a jsonschema validator (proposal constraint: no new dependency).",
  "type": "object",
  "required": [
    "role",
    "source_standard",
    "required_fields",
    "reference_resolution",
    "recomputation",
    "loop_state",
    "use_when"
  ],
  "properties": {
    "role": {
      "type": "string",
      "description": "Role name, matches the sibling roles/<role>.json stem."
    },
    "source_standard": {
      "type": "string",
      "description": "Free text naming the grounding standard(s) this spec's fields/enums are lifted from (e.g. 'EARL 1.0', 'STRIDE / OWASP Threat Dragon')."
    },
    "required_fields": {
      "type": "array",
      "minItems": 1,
      "items": {
        "type": "object",
        "required": ["name", "type", "required"],
        "properties": {
          "name": { "type": "string" },
          "type": { "type": "string", "enum": ["string", "enum", "ref", "ref[]"] },
          "enum": {
            "type": "array",
            "minItems": 1,
            "items": { "type": "string" },
            "description": "Required and non-empty when type is 'enum'; absent otherwise."
          },
          "required": { "type": "boolean" }
        }
      }
    },
    "reference_resolution": {
      "type": "object",
      "required": ["rule", "checked_by"],
      "properties": {
        "rule": { "type": "string" },
        "checked_by": { "type": "string", "description": "Path to the enforcing hook/gate file." }
      }
    },
    "recomputation": {
      "type": "object",
      "required": ["rule", "checked_by"],
      "properties": {
        "rule": { "type": "string" },
        "checked_by": { "type": "string", "description": "Path to the enforcing hook/gate file, or 'TBD (follow-up)' when intentionally deferred." }
      }
    },
    "write_scope": {
      "type": "array",
      "items": { "type": "string" },
      "description": "Real globs the role may write outside its own record. Empty array is legal only paired with report_only: true."
    },
    "report_only": {
      "type": "boolean",
      "description": "Required (true) when write_scope is empty; a role that writes nothing but its own record."
    },
    "loop_state": {
      "type": "object",
      "required": ["progress", "terminal", "refusal", "error"],
      "properties": {
        "progress": { "type": "array", "items": { "type": "string" } },
        "terminal": { "type": "array", "items": { "type": "string" }, "minItems": 1 },
        "refusal": { "type": "array", "items": { "type": "string" } },
        "error": { "type": "array", "items": { "type": "string" } }
      }
    },
    "use_when": {
      "type": "object",
      "required": ["board_condition"],
      "properties": {
        "board_condition": {
          "type": "string",
          "description": "Mechanically evaluable predicate over board/issue state — not a prose sentence requiring LLM interpretation."
        },
        "need_detector": {
          "type": "object",
          "description": "Advisory-only predicate over a TARGET project's file tree (issue #1160 step 3 machinery), read by gates/need_detector.py's needs_due(). The prose `condition` field stays the documented human-readable contract; `present_patterns`/`absent_patterns` are its mechanical sibling.",
          "properties": {
            "condition": {
              "type": "string",
              "description": "Human-readable contract the present_patterns/absent_patterns pair approximates."
            },
            "present_patterns": {
              "type": "array",
              "items": { "type": "string" },
              "description": "Glob patterns (fnmatch/pathlib, evaluated against the target repo root — role fires only when at least one matches)."
            },
            "absent_patterns": {
              "type": "array",
              "items": { "type": "string" },
              "description": "Glob patterns that must NOT match anywhere in the target repo root for the role to be considered due."
            },
            "advisory_only": {
              "type": "boolean",
              "description": "Always true — a need-detector match is printed alongside roles-due, never auto-spawns a role session."
            },
            "false_positive_bound": {
              "type": "string",
              "description": "States the condition under which the detector stays silent even for a plausible-looking target project."
            }
          }
        }
      }
    },
    "playbook_refs": {
      "type": "array",
      "description": "issue #1174 (e): optional pointers from this role's spec to its operational-playbook rulebook sections, one entry per decision axis. Additive to the verification-layer fields above (source_standard/finding_method/anti_pattern) — the playbook holds the decision content, the spec stays the citation address. Absent for a role whose playbook has not landed yet.",
      "items": {
        "type": "object",
        "required": ["axis", "repo", "path", "section"],
        "properties": {
          "axis": { "type": "string", "description": "Decision-axis name, matches the axis list recorded in the target playbook file's own rule_count_floor front matter." },
          "repo": { "type": "string", "description": "e.g. 'tokenmaxxxer/ux-engineering-rulebook', or this repo's own name when the fallback docs/playbook/ location (d) is used." },
          "path": { "type": "string", "description": "Path within repo to the playbook file, e.g. 'playbook/control-selection.md'." },
          "section": { "type": "string", "description": "In-file anchor a quality-bar verdict can cite, e.g. '#field-type-to-control-mapping'." }
        }
      }
    }
  }
}
