{
  "role": "architecture",
  "source_standard": "MADR (Markdown Any Decision Records), https://adr.github.io/madr/",
  "required_fields": [
    {
      "name": "decision_id",
      "type": "ref",
      "required": true
    },
    {
      "name": "context",
      "type": "string",
      "required": true
    },
    {
      "name": "considered_options",
      "type": "ref[]",
      "required": true
    },
    {
      "name": "decision_drivers",
      "type": "string",
      "required": false
    },
    {
      "name": "outcome",
      "type": "enum",
      "required": true,
      "enum": [
        "accepted",
        "rejected",
        "superseded"
      ]
    },
    {
      "name": "axis_evaluation",
      "type": "ref[]",
      "required": false
    }
  ],
  "reference_resolution": {
    "rule": "decision_id must resolve to an actual ADR file under docs/decisions/; considered_options must each resolve to a real alternative discussed in that ADR — no orphan references (issue-515 invariant 2). Each axis_evaluation ref must resolve to a real entry inside this record carrying axis (must be in this role's judgment_axes), verdict (supports|contradicts|no-opinion), and citation (a docs/product/*.md entry path); when verdict is contradicts, the entry must also carry a finding object with target_path (must resolve against some role's write_scope) and a non-empty required_fix (issue-573 architecture proposal, sections 1 and 6).",
    "checked_by": "on-the-record/hooks/role-spec-reference-guard.sh"
  },
  "recomputation": {
    "rule": "outcome is recomputed from the referenced ADR's own status field, never asserted independently of the ADR text.",
    "checked_by": "TBD (follow-up — issue-521 out-of-scope note: per-role recomputation enforcement is a follow-up once evidence from real usage shows which roles need it)"
  },
  "write_scope": [
    "docs/decisions/*.md",
    "docs/issue-<n>/reports/architecture.md"
  ],
  "loop_state": {
    "progress": [
      "drafting",
      "reviewing"
    ],
    "terminal": [
      "landed"
    ],
    "refusal": [
      "decision-not-ripe"
    ],
    "error": [
      "options-unreachable"
    ]
  },
  "use_when": {
    "board_condition": "a cross-module design choice is proposed on the branch AND no architecture record exists yet for that decision"
  }
}
