{
  "role": "finance-unit-economics",
  "source_standard": "SaaS unit-economics metric set (CAC, LTV, LTV:CAC, CAC payback, Rule of 40) — de facto convention popularized by Bessemer's Cloud reports, no single ratified standards body found (scout-brief gap, stated as assumption); https://www.dualentry.com/blog/saas-unit-economics",
  "required_fields": [
    {
      "name": "metric_name",
      "type": "enum",
      "required": true,
      "enum": [
        "CAC",
        "LTV",
        "LTV_CAC_ratio",
        "CAC_payback",
        "Rule_of_40"
      ]
    },
    {
      "name": "value",
      "type": "string",
      "required": true
    },
    {
      "name": "period",
      "type": "string",
      "required": true
    }
  ],
  "reference_resolution": {
    "rule": "metric_name's value must resolve to an actual computed figure from the current billing/finance data source — no fabricated figures.",
    "checked_by": "on-the-record/hooks/role-spec-reference-guard.sh"
  },
  "recomputation": {
    "rule": "value is recomputed from the current period's billing data, never a standalone asserted field.",
    "checked_by": "TBD (follow-up — issue-521 out-of-scope note: per-role recomputation enforcement is a follow-up once evidence from real usage shows which roles need it)"
  },
  "write_scope": [
    "docs/issue-<n>/reports/finance-unit-economics.md"
  ],
  "loop_state": {
    "progress": [
      "computing",
      "reviewing"
    ],
    "terminal": [
      "landed"
    ],
    "refusal": [
      "period-undeclared"
    ],
    "error": [
      "billing-data-unreachable"
    ]
  },
  "use_when": {
    "board_condition": "a finance review checkpoint occurs AND no finance-unit-economics record exists yet for that period"
  }
}
